{
  "$schema": "https://json-schema.org/draft/2020-12/schema",
  "$id": "tradeoffs-trace/phase-contract",
  "title": "Phase contract",
  "description": "The frozen contract a phase is evaluated against: one phase of one plan snapshot (design §1.1, §7.1).",
  "type": "object",
  "required": ["phaseId", "contractVersion", "goal", "acceptance", "checks", "boundaries", "reserved"],
  "additionalProperties": false,
  "properties": {
    "phaseId": { "type": "string", "minLength": 1 },
    "contractVersion": { "$ref": "#/$defs/ContractVersion" },
    "goal": { "type": "string", "minLength": 1 },
    "acceptance": { "type": "array", "items": { "type": "string", "minLength": 1 } },
    "checks": { "type": "array", "items": { "type": "string", "minLength": 1 } },
    "finalChecks": {
      "description": "Plan 06c: the phase's final check, frozen into the contract. Only a candidate that has passed review with no open blocker runs it, once.",
      "type": "array",
      "items": { "type": "string", "minLength": 1 }
    },
    "boundaries": { "type": "array", "items": { "type": "string", "minLength": 1 } },
    "reserved": { "type": "array", "items": { "type": "string", "minLength": 1 } },
    "architecture": { "type": "array", "items": { "type": "object" } },
    "requirements": { "type": "array", "items": { "type": "object" } },
    "constraints": { "type": "array", "items": { "type": "object" } },
    "itemsSynthesized": { "type": "boolean" },
    "workers": {
      "description": "Plan 06g: #+TT_WORKERS frozen into the contract — how many lanes one round runs. Present only when the plan asks for more than one; absent is today's single-candidate loop.",
      "type": "integer",
      "minimum": 2
    },
    "roundsAllowed": {
      "description": "Plan 06g: #+TT_ROUNDS frozen into the contract — how many rounds the phase may spend. Absent means the default of 3 (core/rounds.ts's roundBudget).",
      "type": "integer",
      "minimum": 1
    },
    "seats": {
      "description": "Plan 06h: #+TT_REVIEWERS frozen into the contract. Absent means M A B.",
      "type": "array",
      "items": { "type": "string", "minLength": 1 }
    },
    "leader": {
      "description": "Plan 06h: #+TT_LEADER frozen into the contract. Absent means the first seat.",
      "type": "string",
      "minLength": 1
    },
    "consolidate": {
      "description": "tt 09 (change 3): #+TT_CONSOLIDATE: off frozen into the contract. Present (false) only when the plan turned the combine step off; absent means on whenever the phase runs two or more lanes.",
      "const": false
    },
    "domains": {
      "description": "Plan 07a (D1): the phase's declared domains (#+TT_DOMAINS), frozen into the contract. Absent means domain mode is off, exactly as today.",
      "type": "array",
      "items": { "$ref": "#/$defs/Domain" }
    },
    "fixRounds": {
      "description": "Plan 07c (D4): #+TT_FIX_ROUNDS frozen into the contract. Present only when the plan switched fix rounds on; absent means every round is today's.",
      "const": "domains"
    },
    "fixers": {
      "description": "Plan 07c (D4): #+TT_FIXERS frozen into the contract — the most fixer tasks one fix round runs. Absent means the default of 4.",
      "type": "integer",
      "minimum": 1
    },
    "fixChecks": {
      "description": "Plan 07c (D4): #+TT_FIX_CHECKS frozen into the contract — the fast command every fixer's own commit must pass.",
      "type": "string",
      "minLength": 1
    }
  },
  "$defs": {
    "Domain": {
      "description": "Plan 07a (D1): one declared domain — a name and the repository-relative globs it owns.",
      "type": "object",
      "required": ["name", "globs"],
      "additionalProperties": false,
      "properties": {
        "name": { "type": "string", "minLength": 1 },
        "globs": { "type": "array", "items": { "type": "string", "minLength": 1 } }
      }
    },
    "ContractVersion": {
      "type": "object",
      "required": ["snapshot", "sectionSha256"],
      "additionalProperties": false,
      "properties": {
        "snapshot": { "type": "integer" },
        "sectionSha256": { "type": "string", "pattern": "^[a-f0-9]{64}$" }
      }
    }
  }
}
